{"artifact_family":"official_univtac_act_hf_release","files":[{"kind":"encoder","profile":null,"remote_path":"checkpoints/encoder.pth","sha256":"28097c91a1a1d051f65266fc7fdd84420dc184da9dcfc2006aa40af144cf15bf","size_bytes":165482707,"task_id":null},{"kind":"stats","profile":null,"remote_path":"checkpoints/grasp_classify/univtac/dataset_stats.pkl","sha256":"3bd8d4df70e1129d944462445470dc9d7706471423a5e6df9998afa641a7a335","size_bytes":1845,"task_id":"grasp_classify"},{"kind":"policy","profile":"univtac","remote_path":"checkpoints/grasp_classify/univtac/policy_last.ckpt","sha256":"0220023a804f418cf247e84f76d7f4b9280220d605c25b4521987af84ef17576","size_bytes":382746500,"task_id":"grasp_classify"},{"kind":"policy","profile":"vision_only","remote_path":"checkpoints/grasp_classify/vision_only/policy_last.ckpt","sha256":"20c0dab589b4a04581578be5363668fe599ea5186dcfba16bdb856aeee82d5e8","size_bytes":382746500,"task_id":"grasp_classify"},{"kind":"stats","profile":null,"remote_path":"checkpoints/insert_HDMI/univtac/dataset_stats.pkl","sha256":"8d08577d488442c3833c1d21ed9d6b6f1602af336043714c05d734f73de31114","size_bytes":4213,"task_id":"insert_HDMI"},{"kind":"policy","profile":"univtac","remote_path":"checkpoints/insert_HDMI/univtac/policy_last.ckpt","sha256":"05893cadc6700904b3fed144ed234e7adf4e057a1b37d6474209f078ab03427f","size_bytes":382746500,"task_id":"insert_HDMI"},{"kind":"policy","profile":"vision_only","remote_path":"checkpoints/insert_HDMI/vision_only/policy_last.ckpt","sha256":"857cb6c8601f099e47f1a558bfce22d5fb03f40d0e5ef024116e51c1baa6f100","size_bytes":382746500,"task_id":"insert_HDMI"},{"kind":"stats","profile":null,"remote_path":"checkpoints/insert_hole/univtac/dataset_stats.pkl","sha256":"4f28a439f82ab8bfc0d112e75d915c08b415b6aa27e7ebda18945e2d4a3d0cc5","size_bytes":5909,"task_id":"insert_hole"},{"kind":"policy","profile":"univtac","remote_path":"checkpoints/insert_hole/univtac/policy_last.ckpt","sha256":"f0110759fe9a7d2a09fca033aa9b32045732ee25ba721a94b93c4b8305379c7d","size_bytes":382746500,"task_id":"insert_hole"},{"kind":"policy","profile":"vision_only","remote_path":"checkpoints/insert_hole/vision_only/policy_last.ckpt","sha256":"40a48d7551c0534df0e66ef3ed84944ac48bda0ee22d21079773b66bf94bb1a5","size_bytes":382746500,"task_id":"insert_hole"},{"kind":"stats","profile":null,"remote_path":"checkpoints/insert_tube/univtac/dataset_stats.pkl","sha256":"a1eee654c1e643e49e3bda25f78f0d5f4543fa16da7c816b008de5a0d27952ea","size_bytes":6581,"task_id":"insert_tube"},{"kind":"policy","profile":"univtac","remote_path":"checkpoints/insert_tube/univtac/policy_last.ckpt","sha256":"6260aa3f5e4e89089099e89912dddda7ddd2eb1979efd6186835826f1feddb39","size_bytes":382746500,"task_id":"insert_tube"},{"kind":"policy","profile":"vision_only","remote_path":"checkpoints/insert_tube/vision_only/policy_last.ckpt","sha256":"4c3e48e91ed1bf5d6a988b07e29ed00ebcf0aab81dd566fc92631b203c53e462","size_bytes":382746500,"task_id":"insert_tube"},{"kind":"stats","profile":null,"remote_path":"checkpoints/lift_bottle/univtac/dataset_stats.pkl","sha256":"d0839807c19dadac83188ad8f451d29e1b6b8a9c4212ccf002859f57b3f1af36","size_bytes":10390,"task_id":"lift_bottle"},{"kind":"policy","profile":"univtac","remote_path":"checkpoints/lift_bottle/univtac/policy_last.ckpt","sha256":"a6d5d8c0513357fdbafa1cc658cde03770d434a0dd08993697203e89b0f5d14a","size_bytes":382746500,"task_id":"lift_bottle"},{"kind":"policy","profile":"vision_only","remote_path":"checkpoints/lift_bottle/vision_only/policy_last.ckpt","sha256":"1493dd1cf0ebfb7b4f7312b1778ead1bdd16cf6837288ef89dd6e60eee71a398","size_bytes":382746500,"task_id":"lift_bottle"},{"kind":"stats","profile":null,"remote_path":"checkpoints/lift_can/univtac/dataset_stats.pkl","sha256":"408e1cda38c2fdc8bdb40797f79de921f55ee2b9790ba5ecabbc42e527336c7d","size_bytes":6101,"task_id":"lift_can"},{"kind":"policy","profile":"univtac","remote_path":"checkpoints/lift_can/univtac/policy_last.ckpt","sha256":"524eec391e404ddeca28e753eab31a5e3b17f633f8dff0310266726461e9358c","size_bytes":382746500,"task_id":"lift_can"},{"kind":"policy","profile":"vision_only","remote_path":"checkpoints/lift_can/vision_only/policy_last.ckpt","sha256":"7a7bded7a36451f72cdc44fdcc1e32297b51eecdf74f47d5a2ad136d62871aca","size_bytes":382746500,"task_id":"lift_can"},{"kind":"stats","profile":null,"remote_path":"checkpoints/pull_out_key/univtac/dataset_stats.pkl","sha256":"cb8e34b7101e1a9bf2c0a09c64d2f8038ba0a276014e22822ffbe8e7364a73b3","size_bytes":6005,"task_id":"pull_out_key"},{"kind":"policy","profile":"univtac","remote_path":"checkpoints/pull_out_key/univtac/policy_last.ckpt","sha256":"2973ec8eb78beba9b1a636783921935470be051a675538d63b4fe2c5fd416404","size_bytes":382746500,"task_id":"pull_out_key"},{"kind":"policy","profile":"vision_only","remote_path":"checkpoints/pull_out_key/vision_only/policy_last.ckpt","sha256":"e05ab741c7abc041f433dd07a3e37afde4a30559bd503825c46067979acb572e","size_bytes":382746500,"task_id":"pull_out_key"},{"kind":"stats","profile":null,"remote_path":"checkpoints/put_bottle_in_shelf/univtac/dataset_stats.pkl","sha256":"32e8fa1ba0f764e4e37c952895e5e7693e81f7f4d7cf94f1e439e5331ae3e13d","size_bytes":13142,"task_id":"put_bottle_in_shelf"},{"kind":"policy","profile":"univtac","remote_path":"checkpoints/put_bottle_in_shelf/univtac/policy_last.ckpt","sha256":"f46fdc26bc52ee0e5580c86c09291ee32eb50a5b9b56f555f35b25e40bdd2ce0","size_bytes":382746500,"task_id":"put_bottle_in_shelf"},{"kind":"policy","profile":"vision_only","remote_path":"checkpoints/put_bottle_in_shelf/vision_only/policy_last.ckpt","sha256":"9ffa99425d4e653682acdf7a38d6f50eaa825efb074d26156615ec66908d6487","size_bytes":382746500,"task_id":"put_bottle_in_shelf"}],"repository_id":"byml/UniVTAC","repository_type":"dataset","revision":"172331dbbce95bc04c3e59b22f32dc72ba5561ae","schema_version":"robotactile-act-artifacts-lock-v1","semantic_version":"1.0"}
